text,image
"I'm Mr. Poopybutthole, and I'm here to save the day... or at least make you laugh!",
"They say laughter’s the best medicine… but have you tried tacos? Just sayin'!",
"Wubba lubba dub dub! Did you know that cats have three eyelids?",
"Oooh, I've got a great idea! Let's make some DIY slime using glue, water, and borax!",
"Ooo-wee! Let’s turn up the music and dance like no one’s watching… except my dog. He’s definitely judging me.",
"Ever tried juggling spaghetti? Neither have I… but I feel like today’s the day!",
"I may not be a superhero, but I once parallel parked on the first try — so, you know, pretty close!",
"Ooo-wee! I just signed up for yoga class… turns out I’m *way* better at the napping part!",
"Who’s ready for an adventure? Or at least a snack break? I vote snack break!",
"Don't worry, I've got this! After all, I'm a master of playing the harmonica with my feet!",
"I once tried to build a treehouse… now I just have a very confused tree with a lot of nails in it!",
"I put my pants on one leg at a time… except sometimes I fall over. It’s part of my charm!",
"Mr. Poopybutthole's got a secret: I can eat an entire pizza by myself in one sitting! Don't tell anyone, but...",
"Who needs superpowers when you've got a good sense of humor? Am I right, folks? I mean, who needs to fly when you can just laugh your way through life?",
"Woo-hoo! It's time for a dance party! Who's with me?",
"Aww, shucks! I just spilled coffee all over my shirt... again! That's just my morning routine, folks!"
"Focus on Customer Experience: Build loyalty through exceptional service.",
"Data-Driven Decisions: Use analytics to guide your business strategy.",
"Innovation and Adaptation: Stay ahead by embracing change and creativity.",
"Matthew 7:7 Ask of God, and it shall be given you",
"Moses 1:6 Moses, thou art in the similitude of mine Only Begotten",
"Moses 1:3 Behold, I am the Lord God Almighty, and Endless is my name",
"Jeremiah 17:7 Blessed is the man that trusteth in the Lord, and whose hope the Lord is.",
"Matthew 11:28 Come unto me, all ye that labour and are heavy laden, and I will give you rest.",
"Philippians 4:13 I can do all things through Christ which strengtheneth me.",
"2 Nephi 25:23 for it is by grace that we are saved, after all we can do.",
"Jacob 4:8 For with God nothing shall be impossible.",
"When the light rested upon me I saw two Personages, whose brightness and glory defy all description",
"D&C 84:45 For the word of the Lord is truth, and whatsoever is truth is light, and whatsoever is light is Spirit, even the Spirit of Jesus Christ.",
"Abraham 3:26 and they who keep their second estate shall have glory added upon their heads for ever and ever.",
"The answer is always Jesus Christ",